{
  "$id": "opentronsProtocolSchemaV8",
  "$schema": "http://json-schema.org/draft-07/schema#",

  "definitions": {},

  "type": "object",
  "additionalProperties": false,
  "required": [
    "$otSharedSchema",
    "schemaVersion",
    "metadata",
    "robot",
    "labwareDefinitions",
    "labwareDefinitionSchemaId",
    "commands",
    "commandSchemaId",
    "commandAnnotations",
    "commandAnnotationSchemaId",
    "liquids",
    "liquidSchemaId"
  ],
  "properties": {
    "$otSharedSchema": {
      "description": "The path to a valid Opentrons shared schema relative to the shared-data directory, without its extension.",
      "enum": ["#/protocol/schemas/8"]
    },

    "schemaVersion": {
      "description": "Schema version of a protocol is a single integer",
      "enum": [8]
    },

    "metadata": {
      "description": "Optional metadata about the protocol",
      "type": "object",

      "properties": {
        "protocolName": {
          "description": "A short, human-readable name for the protocol",
          "type": "string"
        },
        "author": {
          "description": "The author or organization who created the protocol",
          "type": "string"
        },
        "description": {
          "description": "A text description of the protocol.",
          "type": ["string", "null"]
        },

        "created": {
          "description": "UNIX timestamp when this file was created",
          "type": "number"
        },
        "lastModified": {
          "description": "UNIX timestamp when this file was last modified",
          "type": ["number", "null"]
        },

        "category": {
          "description": "Category of protocol (eg, \"Basic Pipetting\")",
          "type": ["string", "null"]
        },
        "subcategory": {
          "description": "Subcategory of protocol (eg, \"Cell Plating\")",
          "type": ["string", "null"]
        },
        "tags": {
          "description": "Tags to be used in searching for this protocol",
          "type": "array",
          "items": {
            "type": "string"
          }
        }
      }
    },

    "designerApplication": {
      "description": "Optional data & metadata not required to execute the protocol, used by the application that created this protocol",
      "type": "object",
      "properties": {
        "name": {
          "description": "Name of the application that created the protocol. Should be namespaced under the organization or individual who owns the organization, eg \"opentrons/protocol-designer\"",
          "type": "string"
        },
        "version": {
          "description": "Version of the application that created the protocol",
          "type": "string"
        },
        "data": {
          "description": "Any data used by the application that created this protocol",
          "type": "object"
        }
      }
    },

    "robot": {
      "required": ["model", "deckId"],
      "properties": {
        "model": {
          "description": "Model of the robot this protocol is written for",
          "type": "string",
          "enum": ["OT-2 Standard", "OT-3 Standard"]
        },
        "deckId": {
          "description": "Identifier of physical deck this protocol is written for. This should match a definition in the shared-data directory matching the schema id",
          "type": "string"
        }
      }
    },

    "labwareDefinitionSchemaId": {
      "description": "The schema to use for labware definitions.",
      "type": "string"
    },

    "labwareDefinitions": {
      "description": "All labware definitions used by labware in this protocol, keyed by a unique identifier (definitionId)",
      "patternProperties": {
        ".+": { "type": "object" }
      }
    },

    "liquidSchemaId": {
      "description": "The schema to use for liquid definitions.",
      "type": "string"
    },

    "liquids": {
      "description": "All instances of liquid used in this protocol, keyed by a unique identifier (liquidId)",
      "patternProperties": {
        ".+": { "type": "object" }
      }
    },
    "commandSchemaId": {
      "description": "The schema to which the commands adhere.",
      "type": "string"
    },

    "commands": {
      "description": "An array of command objects representing steps to be executed on the robot.",
      "type": "array",
      "items": { "type": "object" }
    },

    "commandAnnotationSchemaId": {
      "description": "The schema to which the command annotations adhere.",
      "type": "string"
    },

    "commandAnnotations": {
      "type": "array",
      "items": { "type": "object" }
    }
  }
}
